Кластер (1 уровень);Подкластер (2 уровень);Запросы;Интент;Частотность;Конкуренция;Объем контента (слов)
Строительство домов;Цена и стоимость;дом под ключ каркасный цена;Commercial;12491;High;1300-1800
Строительство домов;Каркасные дома;дом каркасный под ключ, дома каркасные под ключ, дома под ключ каркасные, строительство домов каркасных, каркасные дома под ключ московская область, дом купить каркасный, построить каркасный дом, каркасный дом построить;Commercial;304242;Medium;1200-1500
Проектирование;Проект дома с расчётом материалов;проект дома афрейм 6 на 8 c расчетом материала, проект каркасного дома 6х6 одноэтажный с расчетом материала скачать бесплатно, проект каркасного дома 6х6 одноэтажный скачать бесплатно с расчетом материала, скачать проект каркасного дома 6х6 одноэтажный с расчетом материала бесплатно, проект дома с расчетом материалов бесплатно, проект каркасного дома 6х6 одноэтажный с расчетом материала;Commercial;262;Medium;1500-2200
Проектирование;Индивидуальные проекты;заказать проект дома для строительства цена, проектирование и строительство домов;Commercial;1669;Medium;1300-1800
Инженерия;Проект инженерных сетей;проект инженерных сетей для частного дома, проект инженерных сетей дома, проект дома инженерных сетей, проект дома с инженерными сетями, проект инженерных сетей в частном доме, проект дома инженерные сети, проект инженерные сети дома, проект инженерных сетей для частного дома стоимость;Commercial;1294;Medium;1200-1700
Инженерия;Инженерные решения для частного дома;проект инженерных сетей для частного дома, проект инженерных сетей дома, проект дома инженерных сетей, проект дома с инженерными сетями, проект инженерных сетей в частном доме, проект дома инженерные сети, проект инженерные сети дома, проект инженерных сетей для частного дома стоимость;Information;1130;Low;1000-1400
Отделочные работы;Отделочные работы в Махачкале;расценки на отделочные работы в махачкале, стоимость отделочных работ в махачкале, мастер отделочных работ в махачкале, махачкала отделочные работы, отделочные работы махачкала, отделочные работы в махачкале, прайс лист на отделочные работы махачкале, прайс на отделочные работы махачкала;Commercial;549;High;1000-1500
Отделочные работы;Цены и расценки;расценки на отделочные работы в махачкале, стоимость отделочных работ в махачкале, прайс лист на отделочные работы махачкале, прайс на отделочные работы махачкала, прайс на отделочные работы в махачкала, прайс на отделочные работы в махачкале, отделочные работы прайс лист в махачкале, отделочные работы прайс лист махачкала;Commercial;411;High;1000-1400
